{
  "schema_version": 1,
  "kit_version": "1.0.0",
  "project_name": "Technetalks",
  "created_at": "2026-09-12T02:54:29-03:00",
  "mattpocock": {
    "repository": "https://github.com/mattpocock/skills",
    "commit": "3cca18b368ae95cdbdebbff572ccafa662551015",
    "version": "1.2.3",
    "skills": [
      "ask-matt",
      "code-review",
      "codebase-design",
      "diagnosing-bugs",
      "domain-modeling",
      "grill-with-docs",
      "implement",
      "improve-codebase-architecture",
      "prototype",
      "research",
      "resolving-merge-conflicts",
      "setup-matt-pocock-skills",
      "tdd",
      "to-spec",
      "to-tickets",
      "triage",
      "wayfinder",
      "wizard",
      "grill-me",
      "grilling",
      "handoff",
      "teach",
      "to-questionnaire",
      "wait-what",
      "writing-for-agents"
    ]
  },
  "files": {
    ".gitattributes": "d26cbce2b692bbfa7b3c6278f197b8149144c18b5ada556e7ac34080e0c6ea6c",
    ".github/workflows/ai-continuity.yml": "38c8020d086ed5dd2d18f4c0b5764671106e4614269805e5d0c5cca662ad73f4",
    ".gitignore": "cea2c59a9083c3290c6ab715d4a32038e2eb149e27d5d06658e90648f7802562",
    ".agents/skills/project-continuity/SKILL.md": "4968710d902a90e7a60a0f20964df407d5385124169795cefcf265f02eeb40f0",
    ".claude/skills/project-continuity-claude/SKILL.md": "2c2cb9136f81551b670c28909da88c6bbb51aae13fe0d1a45c8ee98340a4ed0f",
    ".agents/skills/MATTPOCOCK-LICENSE": "0e7ac423bf2c6e223b7c5b156f8cf72da49d748e56a1641402c31f22ad07dbb5",
    ".agents/skills/ask-matt/agents/openai.yaml": "bdffbc5a0a99ed1b6ef3253d251d755fd18162b9845972e380007f844b09b05c",
    ".agents/skills/ask-matt/PHASE-BOUNDARIES.md": "a8aa20158609ef39e2b308b6ba0660c91066838d07a867202e63a7744a88a3ed",
    ".agents/skills/ask-matt/SKILL.md": "b25d86fb36b1d294eeead5d7db529f86135f9671f2afcd607579a63bb2213769",
    ".agents/skills/code-review/agents/openai.yaml": "8229ca854e11dc8e6aef2131ee03f31fb1561cf905fab9ccc325180cf3331352",
    ".agents/skills/code-review/SKILL.md": "47f4e52c21694def9c7c11cbfbf891ca35eac7a93e395797515be3c8a409ae50",
    ".agents/skills/codebase-design/agents/openai.yaml": "edebc9e4fcfe102114012575eaa9600b9b5fd08c311664f389c36e7bc717740f",
    ".agents/skills/codebase-design/DEEPENING.md": "f3dd099ce99289bd213914d8ee3e2429b78309c3957ca4583f7659551b1d53c1",
    ".agents/skills/codebase-design/DESIGN-IT-TWICE.md": "8e740bf98446dbd4dfdc132ac4346d9a7eedaf93de6a495889171cf7f99f16bd",
    ".agents/skills/codebase-design/SKILL.md": "2c20617f87ec8af6a434859f381b2f061a69b530444e74eb39e78bb016a6d1e2",
    ".agents/skills/diagnosing-bugs/agents/openai.yaml": "3e430dbe4334a87597488c060cb3dc3786bb00c9182877d6f5ec41f62490e90b",
    ".agents/skills/diagnosing-bugs/scripts/hitl-loop.template.sh": "35103539fc36873eea36074769ad454f9379d6fc8b2dc0e26ce987fd3bfe5503",
    ".agents/skills/diagnosing-bugs/SKILL.md": "77f3cf31bc99b2f49af943222526531fcc9fc41d047626d3640e875e85af3e84",
    ".agents/skills/domain-modeling/ADR-FORMAT.md": "944c92aa790e8fbdc9199640b170979abb8a34ba8d0fe18c2a01a63bce140ca0",
    ".agents/skills/domain-modeling/agents/openai.yaml": "f6bf2aa996c6e6f53fdd0708e18a0d16a56aed8322cca59fedbe3c0d2c75f06b",
    ".agents/skills/domain-modeling/CONTEXT-FORMAT.md": "17ab16ce783e4d2801ee52fd9acdf550cbf44de65ae76797a93943bbedf22a13",
    ".agents/skills/domain-modeling/SKILL.md": "327a2b50620e2fd70abc6893cd6965e76b20f8d0adb0dc2c8d5eb3845efb643e",
    ".agents/skills/grill-with-docs/agents/openai.yaml": "94cd0ab161fb468a836349f5ed482ba58ce8e709a05c57ce533d739dbd35cca9",
    ".agents/skills/grill-with-docs/SKILL.md": "7de372c13488f1ee96cc11cd8907b56b6809cc93eef776eeddd37de6b6cbe3fe",
    ".agents/skills/implement/agents/openai.yaml": "8970a8596ade0c28ab427f41a4ea242d6bdf6186c59ebf55e1238dbecaab79dc",
    ".agents/skills/implement/SKILL.md": "6d3fd9e83b8f36e5213854779db49b256a457a7ebb4a503e53fa7dcff696adc3",
    ".agents/skills/improve-codebase-architecture/agents/openai.yaml": "c8cb20f68ebf0edb4e497bc11ae5fcaa196004e661cd189015b04f4109ced7f1",
    ".agents/skills/improve-codebase-architecture/HTML-REPORT.md": "581e8bb5a521e46bbda8ca7e19b15948bed882187108092ebb90c62513b77528",
    ".agents/skills/improve-codebase-architecture/SKILL.md": "d1ac25511a936ff4250a48dbcefda363837d6bb9321b3cba73df99fa37270a75",
    ".agents/skills/prototype/agents/openai.yaml": "5af65e43ab41a350436697b81e27b7f848d36782043b73c322bb2c9fa9cc55dc",
    ".agents/skills/prototype/LOGIC.md": "f61c7d249e786a79ef289018901c348271e1798dd0b0bc5607b5c6f4d4a01ab9",
    ".agents/skills/prototype/SKILL.md": "714de632d116bb73f65cdb5a882db15b9369a6713b9a47c0fad827848f0bfbe3",
    ".agents/skills/prototype/UI.md": "723211e878acbc7b6ff09755263f3295cde724ba902ff0064da41eed51d45ad3",
    ".agents/skills/research/agents/openai.yaml": "9b4c470d63221c1f68f22df70b83e2f12401b317babe0d1b7b5f24a974474d0d",
    ".agents/skills/research/SKILL.md": "985569f15739c713d6784887c3d186d4ef9ac85bec5ad9c068d25bf0739928e4",
    ".agents/skills/resolving-merge-conflicts/agents/openai.yaml": "a1f4f96838f2ed6282eb28abbbf99029cb8fadce552baf53da90a025b8bffddf",
    ".agents/skills/resolving-merge-conflicts/SKILL.md": "9d8114f8ef0b31f535a265fc05c364bd8cf2e2895a830040e06c22acb11f54b0",
    ".agents/skills/setup-matt-pocock-skills/agents/openai.yaml": "9527de0110541c45712319025155aeab8dc7d77c6ed6e5e83271bab1851ab939",
    ".agents/skills/setup-matt-pocock-skills/domain.md": "edc6d6131fdffc4b7135704f5262124fc43355c95f61b7399dc5a4db643e28ca",
    ".agents/skills/setup-matt-pocock-skills/issue-tracker-github.md": "afd6852a80185217bd28aa5cbe456bef1e85be25be7bd1fba382d5b8ee428325",
    ".agents/skills/setup-matt-pocock-skills/issue-tracker-gitlab.md": "ea175f73d193b3f55819c0ed9bbccf6ee0e70ad8f928e3d7607596c53380acd6",
    ".agents/skills/setup-matt-pocock-skills/issue-tracker-local.md": "7dcda20a2eb4bdc89b95d1143423c0691309921cadae3132e6424f371030506e",
    ".agents/skills/setup-matt-pocock-skills/SKILL.md": "2bcd89e97777cdb705914424e39c97d5db524c8eb4eafac8120778a07774f0ec",
    ".agents/skills/setup-matt-pocock-skills/triage-labels.md": "4f53c9b40ce2651e3611aa090eaedbd6dbc9b71ef8c5f7e65eac0d8263190d0d",
    ".agents/skills/tdd/agents/openai.yaml": "ea6f01cf1b8c06a4b0f5b649d74b1b8ce8685e72af1b38d70d877693e092af0b",
    ".agents/skills/tdd/mocking.md": "3ceb807fdf4a47d6a93d4d9a891e5ba6d362a6247bd08adc451feebfc17361ef",
    ".agents/skills/tdd/SKILL.md": "cb01f66bebfaa25fa1f88e6b7e769cd9fd9f35b1120b8563749820738814c927",
    ".agents/skills/tdd/tests.md": "859f9e592c188fda4fc7277dd180e4ce9c7a2e13f6efe1f6f29eccc9d28c106a",
    ".agents/skills/to-spec/agents/openai.yaml": "1c5b4d1e3d8e52287ef19cc2742fdbbfae1914ac75d33af3e4c8174f08cc55bb",
    ".agents/skills/to-spec/SKILL.md": "43ad9cf318e5e7d3d1fa360253a37021796dc87a0c2e595ad262661a10f85088",
    ".agents/skills/to-tickets/agents/openai.yaml": "21bc6215fffcd7614e9f772bb1760e87cc5fc7dcc707e7d282bc9414267a6090",
    ".agents/skills/to-tickets/SKILL.md": "5c9fba69845c2519b9b35b9af42ae5142c21f8ca15ac2123dc2722002c8058ae",
    ".agents/skills/triage/AGENT-BRIEF.md": "7f5f87fed3033df1b06e083c480f3e847b1fbb0647746b8a4c6a50f9f26ef44f",
    ".agents/skills/triage/agents/openai.yaml": "2e683717720cf456d165d0bb1a68bb600d0b6a8ccb61841c172e50d26f95351c",
    ".agents/skills/triage/OUT-OF-SCOPE.md": "1fbf9b432130c6380aa65813b55553cfda150309b27c595e183f8e335b8a190d",
    ".agents/skills/triage/SKILL.md": "623a2ed692bdc77d2090e2a3dea3b627dd722ad3bbaca0be83aada75292c8fc4",
    ".agents/skills/wayfinder/agents/openai.yaml": "88bc81a11a6d52ac67aeaa76b8b619e387020d47c5133a4dd4927fd15c4ad073",
    ".agents/skills/wayfinder/SKILL.md": "fee6e1d0c50f0e736b4ef8a599060c959afae904c9a97d82c97f049fcc3aa0f1",
    ".agents/skills/wizard/agents/openai.yaml": "98f44d682d58e262f160dc59a8befc365e0aa65820dd0261864af26aa8e59d83",
    ".agents/skills/wizard/SKILL.md": "bdf31d48211ea559878f95a4f344aeabf8d85897488ba564382bab0b000daac1",
    ".agents/skills/wizard/template.sh": "33cbe9dfb1d0e9185b60248a52aabed14bc64785a00cac695e302e739dd6c153",
    ".agents/skills/grill-me/agents/openai.yaml": "c061e39c3e0f9d865fb1b97556d485704af2a8a58f4b8221a8917a5c2074a32b",
    ".agents/skills/grill-me/SKILL.md": "caaf8b8de1684f96e26b28f3c29189db5c89cce4b73e1c93d86164f66ef88637",
    ".agents/skills/grilling/agents/openai.yaml": "1411d7df7d99b7e621a1ff8283c8133cc2464be63d064e52d8ce169c6800ee9b",
    ".agents/skills/grilling/SKILL.md": "10ff989e7498b23b5acb49d5048f11dcd906757d2f79c5cdf8a00001381296f2",
    ".agents/skills/handoff/agents/openai.yaml": "5c479fd562c691851690e8b18c8501045bef0943c10743d636b2fae26add1d28",
    ".agents/skills/handoff/SKILL.md": "7c62de979fdc7ac32fb5ddb2146156c917f80ee070d30fadc9d40343c4b6ed25",
    ".agents/skills/teach/agents/openai.yaml": "5856f3ae8aec742f1499c640aecdd5f1d6af5fa210a7c6ec794de8263a6f733f",
    ".agents/skills/teach/GLOSSARY-FORMAT.md": "9b99859ec28437668130d8f2ce5a342938970f8a1ed4fd38c3eab4f4b5fff210",
    ".agents/skills/teach/LEARNING-RECORD-FORMAT.md": "701fa34b6748aa89e6c960ffb815257f481a7d77fb2900f9028f7edf3fdd6052",
    ".agents/skills/teach/MISSION-FORMAT.md": "8cacbb3c0644d3ae0ea4965564797099401a6930a23f7cf462918576587f2418",
    ".agents/skills/teach/RESOURCES-FORMAT.md": "e9cacf34026e11a8d1c8f9de88abe5bcbf654f4ebdb25cae8c0de0d5f48f44ec",
    ".agents/skills/teach/SKILL.md": "a32df9dcdfc0c4fdc1c98e1ed3940c5f56b84c1aa90ff60346f32b8b53915b43",
    ".agents/skills/to-questionnaire/agents/openai.yaml": "9e8a06c38c8842eea8d4922cb9d1ead8e3ace647bab259b943c994a1b4742bc2",
    ".agents/skills/to-questionnaire/SKILL.md": "b5eb929842ee0e93d867c5e906d183d350f2f2d149eaeaa86967d94d8eda1d3b",
    ".agents/skills/wait-what/agents/openai.yaml": "b41faadf741d51e4ea184148b2d1854d93f947aaf754c7844f70a00f04194999",
    ".agents/skills/wait-what/SKILL.md": "e3f44e3ccbc0e7b62f20ba70b295fc9c9f4aa3f96c77168faee1c71bacbf4215",